<xs:schema xmlns:xs="http://www.w3.org/2001/XMLSchema"
           targetNamespace="https://www.w3schools.com"
           xmlns="https://www.w3schools.com"
           elementFormDefault="qualified">
    <xs:element name="salad">
        <xs:complexType>
            <xs:sequence>
                <xs:element name="ingredient">
                    <xs:complexType>
                        <xs:sequence>
                            <xs:element name="vegetable" maxOccurs="unbounded" minOccurs="0">
                                <xs:complexType>
                                    <xs:sequence>
                                        <xs:element type="xs:string" name="name"/>
                                        <xs:element type="xs:byte" name="caloricvalue"/>
                                        <xs:element type="xs:short" name="weight"/>
                                        <xs:element type="xs:string" name="unit"/>
                                        <xs:element type="xs:string" name="preliminaryprocessing"/>
                                    </xs:sequence>
                                </xs:complexType>
                            </xs:element>
                            <xs:element name="dressing" maxOccurs="unbounded" minOccurs="0">
                                <xs:complexType>
                                    <xs:sequence>
                                        <xs:element type="xs:string" name="name"/>
                                        <xs:element type="xs:short" name="caloricvalue"/>
                                        <xs:element type="xs:byte" name="weight"/>
                                        <xs:element type="xs:string" name="unit"/>
                                        <xs:element type="xs:string" name="lenten"/>
                                    </xs:sequence>
                                </xs:complexType>
                            </xs:element>
                            <xs:element name="seasoning" maxOccurs="unbounded" minOccurs="0">
                                <xs:complexType mixed="true">
                                    <xs:sequence>
                                        <xs:element type="xs:string" name="name"/>
                                        <xs:element type="xs:short" name="caloricvalue"/>
                                        <xs:element type="xs:byte" name="weight"/>
                                        <xs:element type="xs:string" name="unit"/>
                                        <xs:element type="xs:byte" name="hotlevel"/>
                                    </xs:sequence>
                                </xs:complexType>
                            </xs:element>
                        </xs:sequence>
                    </xs:complexType>
                </xs:element>
            </xs:sequence>
            <xs:attribute type="xs:string" name="name"/>
        </xs:complexType>
    </xs:element>
</xs:schema>